{
    "schema": "https://github.com/Project-MONAI/MONAI-extra-test-data/releases/download/0.8.1/meta_schema_20240725.json",
    "version": "0.1.0",
    "changelog": {
        "0.1.0": "complete the model package",
        "0.0.1": "initialize the model package structure"
    },
    "monai_version": "0.9.0",
    "pytorch_version": "1.10.0",
    "numpy_version": "1.21.2",
    "required_packages_version": {
        "nibabel": "3.2.1"
    },
    "task": "Decathlon spleen segmentation",
    "description": "A pre-trained model for volumetric (3D) segmentation of the spleen from CT image",
    "authors": "MONAI team",
    "copyright": "Copyright (c) MONAI Consortium",
    "data_source": "Task09_Spleen.tar from http://medicaldecathlon.com/",
    "data_type": "dicom",
    "image_classes": "single channel data, intensity scaled to [0, 1]",
    "label_classes": "single channel data, 1 is spleen, 0 is everything else",
    "pred_classes": "2 channels OneHot data, channel 1 is spleen, channel 0 is background",
    "eval_metrics": {
        "mean_dice": 0.96
    },
    "intended_use": "This is an example, not to be used for diagnostic purposes",
    "references": [
        "Xia, Yingda, et al. '3D Semi-Supervised Learning with Uncertainty-Aware Multi-View Co-Training. arXiv preprint arXiv:1811.12506 (2018). https://arxiv.org/abs/1811.12506.",
        "Kerfoot E., Clough J., Oksuz I., Lee J., King A.P., Schnabel J.A. (2019) Left-Ventricle Quantification Using Residual U-Net. In: Pop M. et al. (eds) Statistical Atlases and Computational Models of the Heart. Atrial Segmentation and LV Quantification Challenges. STACOM 2018. Lecture Notes in Computer Science, vol 11395. Springer, Cham. https://doi.org/10.1007/978-3-030-12029-0_40"
    ],
    "network_data_format": {
        "inputs": {
            "image": {
                "type": "image",
                "format": "magnitude",
                "num_channels": 1,
                "spatial_shape": [
                    160,
                    160,
                    160
                ],
                "dtype": "float32",
                "value_range": [
                    0,
                    1
                ],
                "is_patch_data": false,
                "channel_def": {
                    "0": "image"
                }
            }
        },
        "outputs": {
            "pred": {
                "type": "image",
                "format": "segmentation",
                "num_channels": 2,
                "spatial_shape": [
                    160,
                    160,
                    160
                ],
                "dtype": "float32",
                "value_range": [
                    0,
                    1
                ],
                "is_patch_data": false,
                "channel_def": {
                    "0": "background",
                    "1": "spleen"
                }
            }
        }
    }
}
